{
  "$schema": "https://json-schema.org/draft/2020-12/schema",
  "$id": "urn:sl-collider:constraint:1.0.0",
  "type": "object",
  "properties": {
    "schema_version": {
      "const": "1.0.0"
    },
    "constraint_id": {
      "type": "string",
      "pattern": "^[A-Za-z0-9][A-Za-z0-9_.-]{0,127}$"
    },
    "snapshot_id": {
      "type": "string",
      "pattern": "^[A-Za-z0-9][A-Za-z0-9_.-]{0,127}$"
    },
    "source_id": {
      "type": "string",
      "pattern": "^[A-Za-z0-9][A-Za-z0-9_.-]{0,127}$"
    },
    "source_version": {
      "type": "string",
      "minLength": 1,
      "maxLength": 32768
    },
    "experiment": {
      "enum": [
        "ATLAS",
        "CMS"
      ]
    },
    "collaboration": {
      "type": "string",
      "minLength": 1,
      "maxLength": 32768
    },
    "analysis_id": {
      "type": "string",
      "pattern": "^[A-Za-z0-9][A-Za-z0-9_.-]{0,127}$"
    },
    "publication_date": {
      "anyOf": [
        {
          "type": "string",
          "minLength": 1,
          "maxLength": 32768
        },
        {
          "type": "null"
        }
      ]
    },
    "data_period": {
      "anyOf": [
        {
          "type": "string",
          "minLength": 1,
          "maxLength": 32768
        },
        {
          "type": "null"
        }
      ]
    },
    "dataset_id": {
      "type": "string",
      "pattern": "^[A-Za-z0-9][A-Za-z0-9_.-]{0,127}$"
    },
    "sqrt_s": {
      "type": "object",
      "properties": {
        "value": {
          "anyOf": [
            {
              "type": "string",
              "pattern": "^[+-]?(?:[0-9]+(?:\\.[0-9]*)?|\\.[0-9]+)(?:[eE][+-]?[0-9]+)?$",
              "maxLength": 128
            },
            {
              "type": "null"
            }
          ]
        },
        "unit": {
          "type": "string",
          "minLength": 1,
          "maxLength": 32768
        },
        "definition": {
          "type": "string",
          "minLength": 1,
          "maxLength": 32768
        }
      },
      "required": [
        "value",
        "unit",
        "definition"
      ],
      "additionalProperties": false
    },
    "luminosity": {
      "type": "object",
      "properties": {
        "value": {
          "anyOf": [
            {
              "type": "string",
              "pattern": "^[+-]?(?:[0-9]+(?:\\.[0-9]*)?|\\.[0-9]+)(?:[eE][+-]?[0-9]+)?$",
              "maxLength": 128
            },
            {
              "type": "null"
            }
          ]
        },
        "unit": {
          "type": "string",
          "minLength": 1,
          "maxLength": 32768
        },
        "definition": {
          "type": "string",
          "minLength": 1,
          "maxLength": 32768
        }
      },
      "required": [
        "value",
        "unit",
        "definition"
      ],
      "additionalProperties": false
    },
    "benchmark_id": {
      "type": "string",
      "pattern": "^[A-Za-z0-9][A-Za-z0-9_.-]{0,127}$"
    },
    "object_class": {
      "enum": [
        "QUANTUM_BLACK_HOLE",
        "SEMICLASSICAL_BLACK_HOLE",
        "STRING_BALL",
        "SPHALERON",
        "GENERIC_HIGH_MULTIPLICITY"
      ]
    },
    "model_family": {
      "anyOf": [
        {
          "type": "string",
          "minLength": 1,
          "maxLength": 32768
        },
        {
          "type": "null"
        }
      ]
    },
    "model_version": {
      "anyOf": [
        {
          "type": "string",
          "minLength": 1,
          "maxLength": 32768
        },
        {
          "type": "null"
        }
      ]
    },
    "n_extra_dimensions": {
      "anyOf": [
        {
          "type": "integer",
          "minimum": 1
        },
        {
          "type": "null"
        }
      ]
    },
    "model_parameters": {
      "type": "array",
      "items": {
        "type": "object",
        "properties": {
          "name": {
            "type": "string",
            "pattern": "^[A-Za-z0-9][A-Za-z0-9_.-]{0,127}$"
          },
          "role": {
            "enum": [
              "FIXED",
              "SCAN"
            ]
          },
          "value": {
            "anyOf": [
              {
                "type": "string",
                "pattern": "^[+-]?(?:[0-9]+(?:\\.[0-9]*)?|\\.[0-9]+)(?:[eE][+-]?[0-9]+)?$",
                "maxLength": 128
              },
              {
                "type": "null"
              }
            ]
          },
          "definition": {
            "type": "string",
            "minLength": 1,
            "maxLength": 32768
          }
        },
        "required": [
          "name",
          "role",
          "value",
          "definition"
        ],
        "additionalProperties": false
      },
      "minItems": 0,
      "maxItems": 1000000
    },
    "assumptions": {
      "type": "object",
      "properties": {
        "generator": {
          "anyOf": [
            {
              "type": "string",
              "minLength": 1,
              "maxLength": 32768
            },
            {
              "type": "null"
            }
          ]
        },
        "pdf": {
          "anyOf": [
            {
              "type": "string",
              "minLength": 1,
              "maxLength": 32768
            },
            {
              "type": "null"
            }
          ]
        },
        "threshold_convention": {
          "anyOf": [
            {
              "type": "string",
              "minLength": 1,
              "maxLength": 32768
            },
            {
              "type": "null"
            }
          ]
        },
        "fundamental_scale_definition": {
          "anyOf": [
            {
              "type": "string",
              "minLength": 1,
              "maxLength": 32768
            },
            {
              "type": "null"
            }
          ]
        },
        "spin": {
          "anyOf": [
            {
              "type": "string",
              "minLength": 1,
              "maxLength": 32768
            },
            {
              "type": "null"
            }
          ]
        },
        "charge": {
          "anyOf": [
            {
              "type": "string",
              "minLength": 1,
              "maxLength": 32768
            },
            {
              "type": "null"
            }
          ]
        },
        "lifetime": {
          "anyOf": [
            {
              "type": "string",
              "minLength": 1,
              "maxLength": 32768
            },
            {
              "type": "null"
            }
          ]
        },
        "decay_regime": {
          "anyOf": [
            {
              "type": "string",
              "minLength": 1,
              "maxLength": 32768
            },
            {
              "type": "null"
            }
          ]
        },
        "branching_ratios": {
          "anyOf": [
            {
              "type": "string",
              "minLength": 1,
              "maxLength": 32768
            },
            {
              "type": "null"
            }
          ]
        },
        "loss_model": {
          "anyOf": [
            {
              "type": "string",
              "minLength": 1,
              "maxLength": 32768
            },
            {
              "type": "null"
            }
          ]
        },
        "remnant": {
          "anyOf": [
            {
              "type": "string",
              "minLength": 1,
              "maxLength": 32768
            },
            {
              "type": "null"
            }
          ]
        }
      },
      "required": [
        "generator",
        "pdf",
        "threshold_convention",
        "fundamental_scale_definition",
        "spin",
        "charge",
        "lifetime",
        "decay_regime",
        "branching_ratios",
        "loss_model",
        "remnant"
      ],
      "additionalProperties": false
    },
    "validity_domain": {
      "anyOf": [
        {
          "type": "string",
          "minLength": 1,
          "maxLength": 32768
        },
        {
          "type": "null"
        }
      ]
    },
    "channel_id": {
      "type": "string",
      "pattern": "^[A-Za-z0-9][A-Za-z0-9_.-]{0,127}$"
    },
    "selection_id": {
      "anyOf": [
        {
          "type": "string",
          "minLength": 1,
          "maxLength": 32768
        },
        {
          "type": "null"
        }
      ]
    },
    "observable_type": {
      "enum": [
        "MASS_THRESHOLD",
        "SIGMA",
        "SIGMA_TIMES_BR",
        "SIGMA_TIMES_ACCEPTANCE",
        "SPHALERON_FRACTION",
        "EVENT_FRACTION",
        "DIMENSIONLESS_PARAMETER",
        "OTHER",
        "EXCLUSION_CONTOUR"
      ]
    },
    "observable_definition": {
      "anyOf": [
        {
          "type": "string",
          "minLength": 1,
          "maxLength": 32768
        },
        {
          "type": "null"
        }
      ]
    },
    "limit_type": {
      "enum": [
        "LOWER_BOUND",
        "UPPER_BOUND",
        "EXCLUDED_REGION"
      ]
    },
    "confidence_level": {
      "anyOf": [
        {
          "type": "string",
          "pattern": "^[+-]?(?:[0-9]+(?:\\.[0-9]*)?|\\.[0-9]+)(?:[eE][+-]?[0-9]+)?$",
          "maxLength": 128
        },
        {
          "type": "null"
        }
      ]
    },
    "statistical_method": {
      "anyOf": [
        {
          "type": "string",
          "minLength": 1,
          "maxLength": 32768
        },
        {
          "type": "null"
        }
      ]
    },
    "unit": {
      "anyOf": [
        {
          "type": "string",
          "minLength": 1,
          "maxLength": 32768
        },
        {
          "type": "null"
        }
      ]
    },
    "observed_value": {
      "anyOf": [
        {
          "type": "string",
          "pattern": "^[+-]?(?:[0-9]+(?:\\.[0-9]*)?|\\.[0-9]+)(?:[eE][+-]?[0-9]+)?$",
          "maxLength": 128
        },
        {
          "type": "null"
        }
      ]
    },
    "expected_value": {
      "anyOf": [
        {
          "type": "string",
          "pattern": "^[+-]?(?:[0-9]+(?:\\.[0-9]*)?|\\.[0-9]+)(?:[eE][+-]?[0-9]+)?$",
          "maxLength": 128
        },
        {
          "type": "null"
        }
      ]
    },
    "expected_bands": {
      "type": "array",
      "items": {
        "type": "object",
        "properties": {
          "label": {
            "type": "string",
            "minLength": 1,
            "maxLength": 32768
          },
          "lower": {
            "type": "string",
            "pattern": "^[+-]?(?:[0-9]+(?:\\.[0-9]*)?|\\.[0-9]+)(?:[eE][+-]?[0-9]+)?$",
            "maxLength": 128
          },
          "upper": {
            "type": "string",
            "pattern": "^[+-]?(?:[0-9]+(?:\\.[0-9]*)?|\\.[0-9]+)(?:[eE][+-]?[0-9]+)?$",
            "maxLength": 128
          }
        },
        "required": [
          "label",
          "lower",
          "upper"
        ],
        "additionalProperties": false
      },
      "minItems": 0,
      "maxItems": 1000000
    },
    "comparison_group": {
      "anyOf": [
        {
          "type": "string",
          "pattern": "^[a-f0-9]{64}$"
        },
        {
          "type": "null"
        }
      ]
    },
    "provenance": {
      "type": "array",
      "items": {
        "type": "object",
        "properties": {
          "source_id": {
            "type": "string",
            "pattern": "^[A-Za-z0-9][A-Za-z0-9_.-]{0,127}$"
          },
          "source_version": {
            "type": "string",
            "minLength": 1,
            "maxLength": 32768
          },
          "sha256": {
            "type": "string",
            "pattern": "^[a-f0-9]{64}$"
          },
          "locator": {
            "type": "string",
            "minLength": 1,
            "maxLength": 32768
          }
        },
        "required": [
          "source_id",
          "source_version",
          "sha256",
          "locator"
        ],
        "additionalProperties": false
      },
      "minItems": 1,
      "maxItems": 1000000
    },
    "extraction_refs": {
      "type": "array",
      "items": {
        "type": "object",
        "properties": {
          "artifact_id": {
            "type": "string",
            "pattern": "^[A-Za-z0-9][A-Za-z0-9_.-]{0,127}$"
          },
          "sha256": {
            "type": "string",
            "pattern": "^[a-f0-9]{64}$"
          }
        },
        "required": [
          "artifact_id",
          "sha256"
        ],
        "additionalProperties": false
      },
      "minItems": 1,
      "maxItems": 1000000
    },
    "missing_fields": {
      "type": "array",
      "items": {
        "type": "string",
        "minLength": 1,
        "maxLength": 32768
      },
      "minItems": 0,
      "maxItems": 1000000
    },
    "validation_status": {
      "enum": [
        "PROPOSED",
        "ACCEPTED",
        "INCOMPLETE",
        "REJECTED"
      ]
    },
    "purpose": {
      "enum": [
        "RESEARCH",
        "TEST_FIXTURE"
      ]
    }
  },
  "required": [
    "schema_version",
    "constraint_id",
    "snapshot_id",
    "source_id",
    "source_version",
    "experiment",
    "collaboration",
    "analysis_id",
    "publication_date",
    "data_period",
    "dataset_id",
    "sqrt_s",
    "luminosity",
    "benchmark_id",
    "object_class",
    "model_family",
    "model_version",
    "n_extra_dimensions",
    "model_parameters",
    "assumptions",
    "validity_domain",
    "channel_id",
    "selection_id",
    "observable_type",
    "observable_definition",
    "limit_type",
    "confidence_level",
    "statistical_method",
    "unit",
    "observed_value",
    "expected_value",
    "expected_bands",
    "comparison_group",
    "provenance",
    "extraction_refs",
    "missing_fields",
    "validation_status",
    "purpose"
  ],
  "additionalProperties": false
}
