{"analysis_id":"EXO-24-028","assumptions":{"branching_ratios":null,"charge":null,"decay_regime":"semiclassical Hawking evaporation; B2","fundamental_scale_definition":"ADD fundamental Planck scale MD; generator convention not independently verified","generator":"BlackMax2.02.0; LO; Pythia8.205 CP5","lifetime":null,"loss_model":"no graviton emission","pdf":"NNPDF3.1 NNLO","remnant":null,"spin":"rotating","threshold_convention":"minimum production mass MBH_min independently scanned above MD"},"benchmark_id":"CMS_B2_n6_MD8","channel_id":"inclusive_multibody","collaboration":"CMS","comparison_group":null,"confidence_level":"0.95","constraint_id":"CMS_B2_n6_MD8_Mmin","data_period":"2016-2018","dataset_id":"CMS_Run2_2016_2018","expected_bands":[],"expected_value":null,"experiment":"CMS","extraction_refs":[{"artifact_id":"extract_e53d3955e6733006cd896e73","sha256":"298cbc886bf5540592fded040d2975ba2bab4fca5cdf63a59f4235a7044801dd"},{"artifact_id":"extract_ae2ccf492c30c880d3093f24","sha256":"9228779988233b15bd1faceda9b4db431549ed4ad00fb8f5a2de219221f5fff7"},{"artifact_id":"extract_7e21e5526e6c4c457316bc7e","sha256":"b1bae8cdbc7da6ff1563c80d1c9aa0856fb408ab8031f9a3660a60e5f0f6501c"},{"artifact_id":"extract_2f6dda1964c71f33e94e4adc","sha256":"43567e76f253184bd736a54ba6be523d641a5747b9f3c5a06caba74b3e6a81a8"},{"artifact_id":"extract_569149fae603d01793a91946","sha256":"a4b9fe25a7daf72290ea82f64431959df36c3edf0be9cd84f85682ff5fefd5ac"},{"artifact_id":"extract_578d8a120198cafac8e2dcce","sha256":"0400bfad9da32b357061328c6ed413b652b37561b043923b831b58629ef4f2ff"},{"artifact_id":"extract_4d098cd4bdc2cda18bd5f7b7","sha256":"e2f5361b24b4ccd82e81fb5a7a992b84b9c36cb48be1190116eeba8f3e258e7e"}],"limit_type":"LOWER_BOUND","luminosity":{"definition":"integrated luminosity of analysis sample","unit":"fb^-1","value":"138"},"missing_fields":["assumptions.branching_ratios","assumptions.charge","assumptions.lifetime","assumptions.remnant","expected_value","observed_value"],"model_family":"ADD","model_parameters":[{"definition":"fundamental Planck scale in TeV","name":"MD","role":"FIXED","value":"8"},{"definition":"minimum black-hole production mass in TeV","name":"MBH_min","role":"SCAN","value":null}],"model_version":"BlackMax2.02.0","n_extra_dimensions":6,"object_class":"SEMICLASSICAL_BLACK_HOLE","observable_definition":"excluded lower threshold mass of the declared generator benchmark","observable_type":"MASS_THRESHOLD","observed_value":null,"provenance":[{"locator":"Ch0.S3.p1.1","sha256":"7fadcfce5fce60055ccd817d98d05c9d09e4c759f1691022a0d3f4f7cf2be955","source_id":"cms_paper_v2","source_version":"2604.10732v2"},{"locator":"Ch0.S3.p2.1","sha256":"7fadcfce5fce60055ccd817d98d05c9d09e4c759f1691022a0d3f4f7cf2be955","source_id":"cms_paper_v2","source_version":"2604.10732v2"},{"locator":"Ch0.S3.p10.1","sha256":"7fadcfce5fce60055ccd817d98d05c9d09e4c759f1691022a0d3f4f7cf2be955","source_id":"cms_paper_v2","source_version":"2604.10732v2"},{"locator":"Ch0.S9.p2.1","sha256":"7fadcfce5fce60055ccd817d98d05c9d09e4c759f1691022a0d3f4f7cf2be955","source_id":"cms_paper_v2","source_version":"2604.10732v2"},{"locator":"Ch0.S9.SS2.p1.1","sha256":"7fadcfce5fce60055ccd817d98d05c9d09e4c759f1691022a0d3f4f7cf2be955","source_id":"cms_paper_v2","source_version":"2604.10732v2"},{"locator":"Ch0.S3.I1.i2.p1.1","sha256":"7fadcfce5fce60055ccd817d98d05c9d09e4c759f1691022a0d3f4f7cf2be955","source_id":"cms_paper_v2","source_version":"2604.10732v2"},{"locator":"Ch0.S3.p6.1","sha256":"7fadcfce5fce60055ccd817d98d05c9d09e4c759f1691022a0d3f4f7cf2be955","source_id":"cms_paper_v2","source_version":"2604.10732v2"}],"publication_date":"2026-08-26","purpose":"RESEARCH","schema_version":"1.0.0","selection_id":"EXO-24-028_PS_Nge4_Sgt0.1_SVMgt0.63","snapshot_id":"cern_lhc_snapshot_2026_10_07","source_id":"cms_paper_v2","source_version":"2604.10732v2","sqrt_s":{"definition":"pp center-of-mass collision energy","unit":"TeV","value":"13"},"statistical_method":"CLs non-asymptotic; log-normal constrained nuisances","unit":"TeV","validation_status":"INCOMPLETE","validity_domain":"MD=8 TeV; Mmin scan 9-12 TeV step 1"}