{"analysis_id":"EXO-24-028","assumptions":{"branching_ratios":null,"charge":null,"decay_regime":"NCS=+/-1 baryon/lepton violating electroweak transition","fundamental_scale_definition":"NOT_APPLICABLE: electroweak model; mW in Eq2","generator":"BaryoGEN v1.0; Pythia8.205 CP5","lifetime":null,"loss_model":null,"pdf":"NNPDF3.1 NNLO","remnant":null,"spin":null,"threshold_convention":"partonic energy threshold E_sph in Heaviside step function"},"benchmark_id":"CMS_sph_E8.75_pNCS0.5","channel_id":"inclusive_multibody","collaboration":"CMS","comparison_group":null,"confidence_level":"0.95","constraint_id":"CMS_sph_E8.75_pNCS0.5_prefactor","data_period":"2016-2018","dataset_id":"CMS_Run2_2016_2018","expected_bands":[],"expected_value":null,"experiment":"CMS","extraction_refs":[{"artifact_id":"extract_e53d3955e6733006cd896e73","sha256":"298cbc886bf5540592fded040d2975ba2bab4fca5cdf63a59f4235a7044801dd"},{"artifact_id":"extract_ae2ccf492c30c880d3093f24","sha256":"9228779988233b15bd1faceda9b4db431549ed4ad00fb8f5a2de219221f5fff7"},{"artifact_id":"extract_7e21e5526e6c4c457316bc7e","sha256":"b1bae8cdbc7da6ff1563c80d1c9aa0856fb408ab8031f9a3660a60e5f0f6501c"},{"artifact_id":"extract_2f6dda1964c71f33e94e4adc","sha256":"43567e76f253184bd736a54ba6be523d641a5747b9f3c5a06caba74b3e6a81a8"},{"artifact_id":"extract_569149fae603d01793a91946","sha256":"a4b9fe25a7daf72290ea82f64431959df36c3edf0be9cd84f85682ff5fefd5ac"},{"artifact_id":"extract_c5bf2c716bc7011f18bfb542","sha256":"7480304ee5832353c92b5e9dc992ca03404ce536cbd8c679f1272f31398f91e7"},{"artifact_id":"extract_203e6fb8f7b293c0c1439082","sha256":"a30b62ed205a63302360493b39595842d98ea91e8ca94112add205aa274ea178"},{"artifact_id":"extract_58a344895827c21413881093","sha256":"a6932d36cca1650263261086fd816e019007bb1857a2de23157ff973a649f828"}],"limit_type":"UPPER_BOUND","luminosity":{"definition":"integrated luminosity of analysis sample","unit":"fb^-1","value":"138"},"missing_fields":["assumptions.branching_ratios","assumptions.charge","assumptions.lifetime","assumptions.loss_model","assumptions.remnant","assumptions.spin","expected_value","n_extra_dimensions","observed_value"],"model_family":"ELECTROWEAK","model_parameters":[{"definition":"sphaleron transition energy threshold in TeV","name":"E_sph","role":"FIXED","value":"8.75"},{"definition":"probability of NCS=+1; remaining NCS=-1","name":"p_NCS_plus1","role":"FIXED","value":"0.5"}],"model_version":"BaryoGEN1.0","n_extra_dimensions":null,"object_class":"SPHALERON","observable_definition":"p_sph pre-exponential factor: partonic sigma=p_sph/mW^2 * Theta(sqrt(s_hat)-E_sph); NOT an event fraction","observable_type":"DIMENSIONLESS_PARAMETER","observed_value":null,"provenance":[{"locator":"Ch0.S3.p1.1","sha256":"7fadcfce5fce60055ccd817d98d05c9d09e4c759f1691022a0d3f4f7cf2be955","source_id":"cms_paper_v2","source_version":"2604.10732v2"},{"locator":"Ch0.S3.p2.1","sha256":"7fadcfce5fce60055ccd817d98d05c9d09e4c759f1691022a0d3f4f7cf2be955","source_id":"cms_paper_v2","source_version":"2604.10732v2"},{"locator":"Ch0.S3.p10.1","sha256":"7fadcfce5fce60055ccd817d98d05c9d09e4c759f1691022a0d3f4f7cf2be955","source_id":"cms_paper_v2","source_version":"2604.10732v2"},{"locator":"Ch0.S9.p2.1","sha256":"7fadcfce5fce60055ccd817d98d05c9d09e4c759f1691022a0d3f4f7cf2be955","source_id":"cms_paper_v2","source_version":"2604.10732v2"},{"locator":"Ch0.S9.SS2.p1.1","sha256":"7fadcfce5fce60055ccd817d98d05c9d09e4c759f1691022a0d3f4f7cf2be955","source_id":"cms_paper_v2","source_version":"2604.10732v2"},{"locator":"Ch0.S3.p8.1","sha256":"7fadcfce5fce60055ccd817d98d05c9d09e4c759f1691022a0d3f4f7cf2be955","source_id":"cms_paper_v2","source_version":"2604.10732v2"},{"locator":"Ch0.S3.p9.2","sha256":"7fadcfce5fce60055ccd817d98d05c9d09e4c759f1691022a0d3f4f7cf2be955","source_id":"cms_paper_v2","source_version":"2604.10732v2"},{"locator":"Ch0.S9.SS2.p9.1","sha256":"7fadcfce5fce60055ccd817d98d05c9d09e4c759f1691022a0d3f4f7cf2be955","source_id":"cms_paper_v2","source_version":"2604.10732v2"}],"publication_date":"2026-08-26","purpose":"RESEARCH","schema_version":"1.0.0","selection_id":"EXO-24-028_PS_Nge4_Sgt0.1_SVMgt0.63","snapshot_id":"cern_lhc_snapshot_2026_10_07","source_id":"cms_paper_v2","source_version":"2604.10732v2","sqrt_s":{"definition":"pp center-of-mass collision energy","unit":"TeV","value":"13"},"statistical_method":"CLs non-asymptotic; log-normal constrained nuisances","unit":"1","validation_status":"INCOMPLETE","validity_domain":"E_sph 8.5-9.5 TeV step0.25; p(NCS=+1)=0/0.5/1; generator p_sph=1"}