{"analysis_id":"EXOT-2024-32","assumptions":{"branching_ratios":"per lepton flavor: uu 11%; ud 5.6%; dd 6.7%","charge":"diquarks uu,ud,dd: QBH charges 4/3,1/3,-2/3","decay_regime":"nonthermal two-body lepton+antiquark; baryon/lepton violation permitted; tau contribution neglected","fundamental_scale_definition":"D-dimensional gravity scale MD of the stated RS/ADD benchmark; QBH convention","generator":"QBH v3.02 + Pythia8 shower/hadronization","lifetime":null,"loss_model":null,"pdf":"CTEQ6L1; factorization scale inverse gravitational radius","remnant":null,"spin":"zero angular momentum J=0","threshold_convention":"Mth=MD; generated MQBH in [1,3]*Mth"},"benchmark_id":"ATLAS_ADD_n4","channel_id":"electron_jet","collaboration":"ATLAS","comparison_group":null,"confidence_level":"0.95","constraint_id":"ATLAS_ADD_n4_electron_jet_Mth","data_period":"2022-2024","dataset_id":"ATLAS_Run3_2022_2024","expected_bands":[],"expected_value":"9.1","experiment":"ATLAS","extraction_refs":[{"artifact_id":"extract_cf254aa30ef83a901eb2eaa3","sha256":"d53f69b3a577a7abb34a5de18734543797cb7af8357f8cd9c7f59b9b99d6d2e2"},{"artifact_id":"extract_d788506b0b542959c98a643b","sha256":"1417cc009143fe0862857c8e8988893fd7bb4018b45dcbe51175437f6a1c415f"},{"artifact_id":"extract_2dfcf6b73d135f4b17a5e951","sha256":"5eb15f7cfd79fee5700a26e6e160b51c813f19bc2503481d68c1ee1b7509d660"}],"limit_type":"LOWER_BOUND","luminosity":{"definition":"integrated luminosity of analysis sample","unit":"fb^-1","value":"164"},"missing_fields":["assumptions.lifetime","assumptions.loss_model","assumptions.remnant"],"model_family":"ADD","model_parameters":[{"definition":"Threshold mass Mth=MD in TeV; QBH mass in [1,3]*Mth","name":"Mth","role":"SCAN","value":null}],"model_version":"QBH3.02","n_extra_dimensions":4,"object_class":"QUANTUM_BLACK_HOLE","observable_definition":"excluded lower threshold mass of the declared generator benchmark","observable_type":"MASS_THRESHOLD","observed_value":"9.1","provenance":[{"locator":"S6.T2/observed:row6,col6;expected:row4,col6;zero_based","sha256":"6871595fe1a737fb5cdcc57f322626d870b24a7afc3060feb3ec4a9186c10444","source_id":"atlas_paper_v2","source_version":"2604.19495v2"},{"locator":"S1.p2.1","sha256":"6871595fe1a737fb5cdcc57f322626d870b24a7afc3060feb3ec4a9186c10444","source_id":"atlas_paper_v2","source_version":"2604.19495v2"},{"locator":"S3.p2.1","sha256":"6871595fe1a737fb5cdcc57f322626d870b24a7afc3060feb3ec4a9186c10444","source_id":"atlas_paper_v2","source_version":"2604.19495v2"}],"publication_date":"2026-09-24","purpose":"RESEARCH","schema_version":"1.0.0","selection_id":"EXOT-2024-32_section4_SR","snapshot_id":"cern_lhc_snapshot_2026_10_07","source_id":"atlas_paper_v2","source_version":"2604.19495v2","sqrt_s":{"definition":"pp center-of-mass collision energy","unit":"TeV","value":"13.6"},"statistical_method":"CLs asymptotic","unit":"TeV","validation_status":"INCOMPLETE","validity_domain":"Mth scan 8-10.5 TeV step 0.5"}